{
  "id": "01-all-agree",
  "category": "unanimous",
  "description": "Three independent sources state the same release date in the same surface form.",
  "config": {
    "query_id": "LEDGERINDEXER_2_0_0_RELEASE_DATE",
    "question": "On what date was version 2.0.0 of LedgerIndexer officially released?",
    "fact_type": "DATE",
    "normalization_rules": {},
    "allowed_enum_values": [],
    "source_urls": [
      "https://raw.githubusercontent.com/GIFTEDLOV/source-consensus/7e58293b4b55fcf57dfc5e24d0d8a9f02e6c2d23/fixtures/corpus/01-all-agree/source-0-release-page.md",
      "https://raw.githubusercontent.com/GIFTEDLOV/source-consensus/7e58293b4b55fcf57dfc5e24d0d8a9f02e6c2d23/fixtures/corpus/01-all-agree/source-1-changelog.md",
      "https://raw.githubusercontent.com/GIFTEDLOV/source-consensus/7e58293b4b55fcf57dfc5e24d0d8a9f02e6c2d23/fixtures/corpus/01-all-agree/source-2-docs-announcement.md"
    ],
    "minimum_supporting_sources": 2,
    "conflict_threshold": 2
  },
  "source_results": [
    {
      "source_index": 0,
      "state": "VALUE",
      "value": "2026-03-11"
    },
    {
      "source_index": 1,
      "state": "VALUE",
      "value": "2026-03-11"
    },
    {
      "source_index": 2,
      "state": "VALUE",
      "value": "2026-03-11"
    }
  ],
  "expected": {
    "status": "CONFIRMED",
    "normalized_value": "2026-03-11"
  },
  "notes": "The base case. Three supporting sources, nothing conflicting, nothing missing."
}
