{
  "id": "07-normalisation-equivalent",
  "category": "normalisation",
  "description": "Three sources state the same date in three different surface forms.",
  "config": {
    "query_id": "CINDERMILL_5_4_0_RELEASE_DATE",
    "question": "On what date was version 5.4.0 of Cindermill officially released?",
    "fact_type": "DATE",
    "normalization_rules": {},
    "allowed_enum_values": [],
    "source_urls": [
      "https://raw.githubusercontent.com/GIFTEDLOV/source-consensus/7e58293b4b55fcf57dfc5e24d0d8a9f02e6c2d23/fixtures/corpus/07-normalisation-equivalent/source-0-release-page.md",
      "https://raw.githubusercontent.com/GIFTEDLOV/source-consensus/7e58293b4b55fcf57dfc5e24d0d8a9f02e6c2d23/fixtures/corpus/07-normalisation-equivalent/source-1-blog.md",
      "https://raw.githubusercontent.com/GIFTEDLOV/source-consensus/7e58293b4b55fcf57dfc5e24d0d8a9f02e6c2d23/fixtures/corpus/07-normalisation-equivalent/source-2-docs.md"
    ],
    "minimum_supporting_sources": 2,
    "conflict_threshold": 2
  },
  "source_results": [
    {
      "source_index": 0,
      "state": "VALUE",
      "value": "2026-01-05"
    },
    {
      "source_index": 1,
      "state": "VALUE",
      "value": "2026-01-05"
    },
    {
      "source_index": 2,
      "state": "VALUE",
      "value": "2026-01-05"
    }
  ],
  "expected": {
    "status": "CONFIRMED",
    "normalized_value": "2026-01-05"
  },
  "notes": "'2026-01-05', '5 January 2026' and 'January 5, 2026' are one fact. Without normalisation to a canonical form this case would derive CONFLICTED from three sources that agree -- the single most likely false negative in the design."
}
